{"action_id":"22a959e8-b147-4c15-b979-6138d13e3788","case_id":"c4ce877d-29fc-4d74-af73-ddee1599a643","case_sha256":"5023b3112903542eb31430bd1bb4a1c1a8aa1652d33f8414f3175cc6fee80b47","charge_basis":"LOCAL_SIMULATION_NO_PROVIDER_REQUEST","context_manifest_id":"b48f087f-c12c-44f0-9290-6d604635e65d","execution_scope":"LOCAL_COMPONENT","external_request_sent":false,"input_data_kind":"SIMULATION","input_sha256":"fcdfb482ecad4537c6893d2ea67e5ef924bdac4e9c1201a0c6cf0ceaad30efd4","invocation_id":"4f80df33-f7a6-4509-8ebe-0428de4d52e7","model_config_revision":"42eeb3f1-d789-4b91-9740-5e59e5798e9d","model_result_schema_ref":"https://schemas.medical-agent.invalid/1.0.0/agent-design/model-stream.schema.json#/$defs/ModelResult","model_result_schema_sha256":"9a379c8c9d292f8a24e2a7a153b91598aa00d96f024772829246192b96a5d378","model_result_sha256":"226059bcbfcd34bca0dbb9a5d2eda9fc0a7e2ac3743b517000b36e5bce97f6b7","parameters_sha256":"e12b22218123b752de5574f6b92d59c9572f5fa5de0203175c555f984fbbc90d","production_eligible":false,"project_id":"5d96ad55-a12e-472a-93a1-2cbf847b0662","provider_charge_amount":"0.00000000","receipt_id":"63c849ef-e443-4eff-bcff-20c1db5268fe","request_sha256":"6ebbd69c53969ff93662c475cc692e46ce7a772e79356aca689ac34fe0d9cb5e","run_id":"7343abc7-4c7e-451d-8eeb-e5e37ce255f7","schema_version":"1.0.0","settings_sha256":"eea34830ee661b751b24cfb15790fd495c8a9f440a0ef0f97da29605ecbb53f8","step_id":"08143853-da73-41cc-aa7e-466c8c847498","tenant_id":"023e4825-88c8-4143-b8a4-d0052196832e","usage_origin":"UNKNOWN"}